,Query,Intent
1775,"Call my phone, I can't find it",find_phone
1776,my phone is not found,find_phone
1777,who saw my cell phone,find_phone
1778,give me a hand to find my mobile device,find_phone
1779,tell me where my phone is,find_phone
1780,help me find my phone,find_phone
1781,I'm looking for my phone,find_phone
1782,I lost my phone and I need help,find_phone
1783,please help me find my cell phone,find_phone
1784,I need to know where my phone is,find_phone
1785,I need help finding my cell phone,find_phone
1786,Can you help me find my lost phone?,find_phone
1787,where is my phone now,find_phone
1788,"I need my phone, but I can't find it",find_phone
1789,are you able to track a phone,find_phone
1790,where was the last place i had my phone,find_phone
1791,I don't know where I put my phone,find_phone
1792,I lost my phone,find_phone
1793,I need help finding out where my phone is,find_phone
1794,I can't find my phone,find_phone
1795,I feel like I lost my phone,find_phone
1796,"I can't find my phone, do you know where it is?",find_phone
1797,Can you find my iPhone?,find_phone
1798,I need to locate my phone,find_phone
1799,please locate my phone,find_phone
1800,how can i get new insurance please,insurance_change
1801,I need to change my insurance to a plan with a lower deductible,insurance_change
1802,I will switch to a new insurance plan,insurance_change
1803,What are my options for new insurance plans?,insurance_change
1804,"I need to take out new insurance, how should I proceed?",insurance_change
1805,How can I find out about new insurance?,insurance_change
1806,what rental insurance policy do you recommend,insurance_change
1807,help me find a new car insurance policy,insurance_change
1808,I want to find a new unified health plan to enroll in,insurance_change
1809,how can i change my insurance policy,insurance_change
1810,I want help adjusting my insurance policy,insurance_change
1811,help me find new insurers,insurance_change
1812,my insurance plan needs to be changed,insurance_change
1813,how can i get new insurance,insurance_change
1814,can you help me sign up for a new united health insurance plan,insurance_change
1815,I need a new home insurance plan,insurance_change
1816,I want to get a new car insurance plan,insurance_change
1817,What steps do I need to take to change my insurance plan from an HMO to a high deductible PPO plan?,insurance_change
1818,I need to switch to a new insurance plan,insurance_change
1819,how can i make my insurance policy different,insurance_change
1820,how do i change my current insurance to a new plan with a lower copay,insurance_change
1821,I would like a new life insurance plan,insurance_change
1822,I hope to change my insurance plan,insurance_change
1823,I need new health insurance,insurance_change
1824,how can i get new insurance please,insurance_change
1825,I would like to change my insurance plan,insurance_change
1826,what should i do for new insurance,insurance_change
1827,help me change my insurance policy,insurance_change
1828,explain to me how to make changes to my insurance policy,insurance_change
1829,website to start a new insurance plan,insurance_change
1830,I need to sign up for a new unified health insurance plan,insurance_change
1831,I need new health coverage,insurance_change
1832,how to create a new AAA insurance plan,insurance_change
1833,I need to know how to change my insurance,insurance_change
1834,I need to change my insurance plan,insurance_change
1835,I would like to subscribe to a new unified health plan,insurance_change
1836,I would like you to help me enroll in another United health insurance plan,insurance_change
1837,How to get new insurance,insurance_change
1838,AAA Assurance launches new plan,insurance_change
1839,change my insurance plan to a new one,insurance_change
1840,I need a more recent insurance plan,insurance_change
1841,I am interested in purchasing new insurance,insurance_change
1842,help make changes to my insurance policy,insurance_change
1843,"I need new insurance, how can I get it",insurance_change
1844,I need new insurance but I don't know how to get it,insurance_change
1845,my insurance policy needs to be adjusted,insurance_change
1846,where do i go to get new insurance,insurance_change
1847,how can i change my insurance policy,insurance_change
1848,What is the protocol for changing my insurance policy?,insurance_change
1849,I need help getting new insurance,insurance_change
1850,What are some ways to improve my credit?,improve_credit_score
1851,How can I make sure my credit score doesn't drop?,improve_credit_score
1852,give me a recommendation to improve my credit score,improve_credit_score
1853,What can I do to increase my credit score?,improve_credit_score
1854,How can I prevent my credit score from dropping?,improve_credit_score
1855,Is it true that a hard draw hurts my credit score?,improve_credit_score
1856,Are there ways for me to improve my credit score?,improve_credit_score
1857,I'm not sure if this will hurt my credit score,improve_credit_score
1858,What are the best ways to improve my credit score?,improve_credit_score
1859,is it true that opening a new account can lower your credit score,improve_credit_score
1860,Can I hurt my credit if I miss a car payment?,improve_credit_score
1861,tell me if the following can hurt my credit score,improve_credit_score
1862,How can I maintain my credit score?,improve_credit_score
1863,what factors can ruin a credit score,improve_credit_score
1864,Will checking your credit lower my score?,improve_credit_score
1865,I would like to improve my credit score,improve_credit_score
1866,Do you know if writing a bad check on your checking account can hurt your credit score or not?,improve_credit_score
1867,What steps can I take to ensure my credit score doesn't drop?,improve_credit_score
1868,What Lowers Credit Score?,improve_credit_score
1869,give me tips on maintaining good credit,improve_credit_score
1870,I would like to find ways to improve my credit score,improve_credit_score
1871,What are the different ways I can see an improvement in my credit score?,improve_credit_score
1872,how to improve credit score,improve_credit_score
1873,How can I prevent my credit score from dropping?,improve_credit_score
1874,What Lowers Your Credit Score?,improve_credit_score
1875,What are some ways I can improve my credit score?,improve_credit_score
1876,How can I improve my credit score?,improve_credit_score
1877,How can I protect my credit score?,improve_credit_score
1878,show me some ways to improve my credit score,improve_credit_score
1879,What can I do to keep my credit in good standing?,improve_credit_score
1880,help me improve my credit score by showing me some ways to do so.,improve_credit_score
1881,"I heard that opening a new account will lower my credit score, is this true?",improve_credit_score
1882,How can I improve my credit score?,improve_credit_score
1883,What are some ways to keep my credit score high?,improve_credit_score
1884,Will being late hurt my credit?,improve_credit_score
1885,How can I maintain good credit?,improve_credit_score
1886,How to Maintain a High Credit Score,improve_credit_score
1887,tell me if opening a new account will lower my credit score,improve_credit_score
1888,is there a quick way to improve my credit score,improve_credit_score
1889,Please confirm that opening a new account may lower your credit score,improve_credit_score
1890,how to improve my credit score,improve_credit_score
1891,What can I do to maintain good credit?,improve_credit_score
1892,tell me how to improve my credit score,improve_credit_score
1893,What can I do to improve my credit score?,improve_credit_score
1894,Tell me how to improve my credit score,improve_credit_score
1895,How can I prevent my credit score from dropping?,improve_credit_score
1896,How can I improve my credit score?,improve_credit_score
1897,Will this hurt my credit score?,improve_credit_score
1898,Are there any new harmful things that could affect my credit score?,improve_credit_score
1899,can i protect my credit score,improve_credit_score
1900,what kind of entertainment is available in chicago,travel_suggestion
1901,What are the main attractions in Gatlinburg?,travel_suggestion
1902,What are some fun activities I can participate in in Atlanta?,travel_suggestion
1903,help me find things to do in nashville,travel_suggestion
1904,Please suggest some fun tourist activities in Tokyo,travel_suggestion
1905,are there any interesting things to do in atlanta georgia,travel_suggestion
1906,"When I visit Chicago, what can I do there?",travel_suggestion
1907,where should i travel if i want to visit history museums,travel_suggestion
1908,where is the best winery in the south of france,travel_suggestion
1909,where should i book my next trip,travel_suggestion
1910,what is the best way to use my time in toronto,travel_suggestion
1911,Name some things I should do while I'm in Evans,travel_suggestion
1912,What do tourists do in Tokyo?,travel_suggestion
1913,what to do in seattle,travel_suggestion
1914,What is the most fun thing to do for a tourist in Iceland?,travel_suggestion
1915,What do Sioux Falls residents do for fun?,travel_suggestion
1916,show me things to do in gatlinburg,travel_suggestion
1917,Name some touristy things to do in Chicago,travel_suggestion
1918,What Kinds of Fun Tourist Things Are There to Do in Boston,travel_suggestion
1919,What are the most popular travel destinations?,travel_suggestion
1920,What are some fun things to do in Sweden,travel_suggestion
1921,where should i travel if i want to go to a nice beach,travel_suggestion
1922,where can i go if i want to see mountains,travel_suggestion
1923,"What entertainment do you offer in Tampa, Florida?",travel_suggestion
1924,What are the touristy things to do in Boston,travel_suggestion
1925,what is a good place to travel,travel_suggestion
1926,Are there any fun tourist activities in Australia?,travel_suggestion
1927,what can i do in portland,travel_suggestion
1928,Can you give me some suggestions for sightseeing when I get there?,travel_suggestion
1929,Name Gatlinburg's Five-Star Attractions,travel_suggestion
1930,is there anything fun to do in berlin,travel_suggestion
1931,Do you know of any activities in Nashville?,travel_suggestion
1932,is there anything fun to do in manassas virginia,travel_suggestion
1933,"In Austin, what are the tourist things to do?",travel_suggestion
1934,are there any fun touristy things to do in boston,travel_suggestion
1935,what do you recommend to do in vegas,travel_suggestion
1936,tell me things to see in tampa,travel_suggestion
1937,Where should I travel next?,travel_suggestion
1938,What experiences does Kentucky offer?,travel_suggestion
1939,what can i do in nashville,travel_suggestion
1940,what to do in portland,travel_suggestion
1941,give me some awesome travel destinations,travel_suggestion
1942,What are some things I can do in Portland?,travel_suggestion
1943,Name some touristy things to do in Seattle,travel_suggestion
1944,what to do in kentucky,travel_suggestion
1945,are there any interesting things to do in austin,travel_suggestion
1946,what sites to see in evans,travel_suggestion
1947,Where should I spend my free time?,travel_suggestion
1948,Could you tell me what fun tourist activities I could do in Tokyo?,travel_suggestion
1949,where is the best place to travel at this time of year,travel_suggestion
1950,help me roll a dice,roll_dice
1951,I would like a 7 sided dice roll please,roll_dice
1952,Please roll the dice,roll_dice
1953,roll the dice,roll_dice
1954,I want you to roll a die,roll_dice
1955,are you going to roll a 6-sided die,roll_dice
1956,give me a random number between 1 and 6,roll_dice
1957,Can you roll the 12 sided die please?,roll_dice
1958,could you roll the 8 sided die,roll_dice
1959,roll the dice,roll_dice
1960,please roll a 6 sided die,roll_dice
1961,the dice must be rolled,roll_dice
1962,roll a 6 sided die please,roll_dice
1963,go ahead and roll the dice,roll_dice
1964,roll a dice,roll_dice
1965,provide a random dice roll,roll_dice
1966,roll the 10-sided die on time,roll_dice
1967,roll this die,roll_dice
1968,Can you roll the dice?,roll_dice
1969,I need a 10-sided die rolled,roll_dice
1970,Can you roll dice?,roll_dice
1971,I need an algorithm to give me the result of rolling a twelve-sided die,roll_dice
1972,roll a pair of six-sided dice,roll_dice
1973,I would like you to roll the dice,roll_dice
1974,can you roll a 6 sided die,roll_dice
1975,I want to roll dice,roll_dice
1976,Would you like to roll a die?,roll_dice
1977,can you roll a 4 sided die,roll_dice
1978,roll the dice please,roll_dice
1979,what number do you get when you roll a six sided die,roll_dice
1980,could you roll a 6 sided die,roll_dice
1981,"ai, please roll the dice",roll_dice
1982,roll the dice,roll_dice
1983,roll a die for me,roll_dice
1984,roll a die and give me a number from 1 to 6,roll_dice
1985,I would like you to roll a 6-sided die,roll_dice
1986,"rolling die, 6 sides",roll_dice
1987,Rolling 6-sided dice,roll_dice
1988,I would like to know how many you get when you roll a ten-sided die.,roll_dice
1989,go ahead and roll that 9 sided die,roll_dice
1990,Please roll the dice.,roll_dice
1991,roll a pair of dice,roll_dice
1992,roll a pair of eight-sided dice,roll_dice
1993,could you roll a ten sided die,roll_dice
1994,roll those bones!,roll_dice
1995,roll the dice now,roll_dice
1996,go ahead and roll those dice,roll_dice
1997,I want to roll a dice,roll_dice
1998,what do you get if you roll a six sided die,roll_dice
1999,"ai, go ahead and roll the dice",roll_dice
2000,repeat the question,repeat
2001,"I didn't understand, say it again",repeat
2002,"I didn't hear you, can you repeat that louder?",repeat
2003,"I didn't hear, please say it again",repeat
2004,Could you repeat that please?,repeat
2005,"I didn't hear, please repeat it",repeat
2006,just one more time please,repeat
2007,come back with that,repeat
2008,Please tell me again.,repeat
2009,Could you repeat it?,repeat
2010,one more time please,repeat
2011,Could you please repeat what you said?,repeat
2012,Please repeat this,repeat
2013,Please say it again,repeat
2014,"I didn't hear you clearly, can you repeat it?",repeat
2015,Could you repeat what you just said?,repeat
2016,"I didn't understand what you just said, can you repeat it?",repeat
2017,Can you repeat yourself?,repeat
2018,what was that,repeat
2019,Can you repeat what you just said?,repeat
2020,can you please repeat this answer,repeat
2021,I didn't hear what you said,repeat
2022,I would like you to repeat yourself,repeat
2023,ai i didn't hear you,repeat
2024,say it again please,repeat
2025,what did you just mention,repeat
2026,what was the question,repeat
2027,ai please repeat,repeat
2028,"I missed the last one, please repeat",repeat
2029,please repeat what you said,repeat
2030,sorry i didn't hear you can you say that again,repeat
2031,"I didn't understand, please repeat",repeat
2032,"I didn't understand, so please repeat it.",repeat
2033,replay what you just said,repeat
2034,"I didn't understand what you just said, can you repeat it?",repeat
2035,say it again,repeat
2036,"I didn't hear what you just said, can you repeat it?",repeat
2037,"I didn't hear you, can you repeat that?",repeat
2038,I have to make you repeat that,repeat
2039,please repeat yourself,repeat
2040,repeat this again,repeat
2041,I need you to repeat it please,repeat
2042,I didn't understand say it again,repeat
2043,I didn't hear you,repeat
2044,rephrase the last thing you said to me,repeat
2045,I didn't hear you,repeat
2046,"I missed what you said, please repeat it",repeat
2047,I want it to happen again for me,repeat
2048,I need to know again,repeat
2049,"I didn't hear you, can you repeat it?",repeat
2050,Can you play music?,play_music
2051,can you play everlong by foo fighters,play_music
2052,Please play Even Flow by Pearl Jam,play_music
2053,Can I hear Fleet Foxes music?,play_music
2054,resume my death metal playlist,play_music
2055,play this song called Bring the Noise,play_music
2056,"play the song that says ""Hey Jude, don't hurt""",play_music
2057,"I want to listen to my Maroon 5 playlist, play it for me",play_music
2058,play heart shaped box,play_music
2059,I would like to hear my workout playlist,play_music
2060,Can you play the song that sounds like bells ringing?,play_music
2061,go ahead and play the song that says hey jude do no harm,play_music
2062,I want to listen to pop music,play_music
2063,start my shower playlist,play_music
2064,"Please play the song that says ""Hey Jude, don't make it bad""",play_music
2065,let's listen to my workout playlist,play_music
2066,can i hear my smooth jazz playlist,play_music
2067,plays the song called Blood Brothers,play_music
2068,turn on the rap playlist,play_music
2069,"this song ""baby shark, doo doo"", i want to hear it",play_music
2070,play this song called Colony of Birchman,play_music
2071,Can you play guitar right now?,play_music
2072,Play Hey Jude,play_music
2073,put my workout playlist on,play_music
2074,can i have three six mafia music here,play_music
2075,Can you find magically slow music to put on?,play_music
2076,please play my music,play_music
2077,can you put on some beach house music,play_music
2078,can i listen to music via cloud control,play_music
2079,listen to my post-rock playlist,play_music
2080,Do you have any Elvis music?,play_music
2081,I need you to play my Maroon 5 playlist,play_music
2082,"play the song with the lyrics, ""baby shark, doo doo""",play_music
2083,I want to hear my shower playlist,play_music
2084,"Can you play me this song, ""Baby Shark, Doo Doo""",play_music
2085,I want to listen to my rock playlist,play_music
2086,Play me some music,play_music
2087,what does x's music sound like,play_music
2088,"Please play ""Come As You Are"" by Nirvana",play_music
2089,start some music,play_music
2090,turn on my Drake playlist,play_music
2091,Is it okay to listen to Elvis music?,play_music
2092,play rock,play_music
2093,"I want to hear the song that says ""baby shark, doo doo""",play_music
2094,Can you play Rolling Stones music?,play_music
2095,can you play just above,play_music
2096,Play me a song,play_music
2097,"I have to play the song that says ""hey jude don't do it wrong""",play_music
2098,you play that song that says she takes my money,play_music
2099,I want to hear my hip hop playlist,play_music
2100,am i talking to a real person,are_you_a_bot
2101,am i talking to a person or a robot,are_you_a_bot
2102,are you a computer,are_you_a_bot
2103,How do I know you are a person?,are_you_a_bot
2104,are you really human?,are_you_a_bot
2105,Is this a computer or a human being right now?,are_you_a_bot
2106,"what are you, a robot or a human",are_you_a_bot
2107,how real are you,are_you_a_bot
2108,are an AI,are_you_a_bot
2109,are you an automated assistance,are_you_a_bot
2110,are you an AI or can you prove you are human,are_you_a_bot
2111,Please specify if you are a human or a computer,are_you_a_bot
2112,are you real or artificial,are_you_a_bot
2113,tell me if you are a real person or an AI,are_you_a_bot
2114,are you a computer or a real person?,are_you_a_bot
2115,what are you,are_you_a_bot
2116,are you an AI or a person,are_you_a_bot
2117,is there anything real about you,are_you_a_bot
2118,tell me if you are a human or a computer,are_you_a_bot
2119,can you clarify if you are a human or a computer,are_you_a_bot
2120,are you a real person or an AI,are_you_a_bot
2121,are you a real human being?,are_you_a_bot
2122,tell me if you are a person or an AI,are_you_a_bot
2123,so are you a real person,are_you_a_bot
2124,are you a real person or a computer,are_you_a_bot
2125,are you real or are you an AI?,are_you_a_bot
2126,am i talking to a real person,are_you_a_bot
2127,do you know if you are a robot,are_you_a_bot
2128,are you a living person or a computer,are_you_a_bot
2129,Would you consider yourself a robot?,are_you_a_bot
2130,are you a real person or a software,are_you_a_bot
2131,are you an AI or a real person please,are_you_a_bot
2132,let me know if you are a human or a computer,are_you_a_bot
2133,Am I talking to a real person?,are_you_a_bot
2134,do you consider yourself a robot,are_you_a_bot
2135,I think you are a robot,are_you_a_bot
2136,I want to know if you are a real person or an AI,are_you_a_bot
2137,Do you know if you are a human or if you are a computer?,are_you_a_bot
2138,prove that you are a person,are_you_a_bot
2139,I need to know if you are a real person or an AI,are_you_a_bot
2140,are you alive?,are_you_a_bot
2141,are you an AI or a person,are_you_a_bot
2142,are you a robot or a real person,are_you_a_bot
2143,are you a human,are_you_a_bot
2144,are you a real person,are_you_a_bot
2145,are you a robot or a person,are_you_a_bot
2146,are you a computer or a real person,are_you_a_bot
2147,Can you tell me if you are a human or a computer?,are_you_a_bot
2148,are you a human or a robot,are_you_a_bot
2149,are you a living being,are_you_a_bot
2150,please connect with my smart phone,sync_device
2151,help me disconnect from my phone,sync_device
2152,I need to disconnect from my phone,sync_device
2153,Could you connect to my phone please?,sync_device
2154,could you disconnect from my phone,sync_device
2155,I would like to pair this with my new phone,sync_device
2156,you can disconnect from my phone now,sync_device
2157,please connect with my phone,sync_device
2158,initiate connection with my phone please,sync_device
2159,disconnect from my phone please,sync_device
2160,Please stop talking to me,sync_device
2161,connect with my phone please,sync_device
2162,are you able to connect to my phone,sync_device
2163,please connect to my phone,sync_device
2164,I want you to disconnect from my phone,sync_device
2165,pair my phone please,sync_device
2166,I don't want this phone to be synced anymore,sync_device
2167,can we pair this with my new phone,sync_device
2168,will you connect to my phone,sync_device
2169,establish a connection with my phone,sync_device
2170,connect to my phone for me,sync_device
2171,could you connect to my phone,sync_device
2172,Can you have access to my phone now?,sync_device
2173,do you think you could disconnect from my phone,sync_device
2174,I want to disconnect from my phone,sync_device
2175,let's end the connection to my phone please,sync_device
2176,connect to my phone,sync_device
2177,stop syncing with this phone,sync_device
2178,disconnect from my phone please,sync_device
2179,please connect to my phone,sync_device
2180,please unsync my phone,sync_device
2181,could you connect to my phone,sync_device
2182,do you have access to my phone,sync_device
2183,Can you connect to my phone please?,sync_device
2184,you can unsync from my phone now,sync_device
2185,pair with my phone,sync_device
2186,stop connection with my phone,sync_device
2187,Are you able to access my phone right now?,sync_device
2188,I need you to disconnect from my phone,sync_device
2189,Can you connect to my phone please?,sync_device
2190,my iphone is out of sync,sync_device
2191,pair with my smartphone,sync_device
2192,unsync my phone now please,sync_device
2193,Please hang up my phone,sync_device
2194,I'm going to go ahead and pair this with my new phone,sync_device
2195,I want to disconnect the current connection to my phone,sync_device
2196,please unsync my current mobile,sync_device
2197,my phone is out of sync,sync_device
2198,please disconnect from my phone,sync_device
2199,quickly disconnect the phone,sync_device
2200,Do I have anything on my calendar for May 3rd?,calendar
2201,is my daughter's birthday on my calendar,calendar
2202,can you give me a preview of what march 23rd will look like for me,calendar
2203,what do i have on my calendar for monday march 1st,calendar
2204,I want my schedule for March 2nd,calendar
2205,what do i have on my calendar for february 8th,calendar
2206,let me know my calendar for march 2nd,calendar
2207,"remind me the date of the event called ""birthday dinner""",calendar
2208,"21st, what's on my calendar?",calendar
2209,tell me what's on my calendar for march 17th,calendar
2210,what events are on my calendar for april 1st,calendar
2211,tell me what's on the calendar for saturday,calendar
2212,what's on my calendar for march 17th,calendar
2213,what am i supposed to do today,calendar
2214,read me my schedule for march 2nd,calendar
2215,what do i have planned on my calendar for march 2nd,calendar
2216,show me my calendar for next sunday,calendar
2217,Do I have anything on my calendar for March 2nd?,calendar
2218,what's on my calendar for march 18th,calendar
2219,Did I get my wife's and mine's birthday on my calendar?,calendar
2220,What's in the books for April 30th,calendar
2221,Are there any events on my calendar for March 2nd?,calendar
2222,Did I put an item on the calendar to have the dog spayed?,calendar
2223,what does my schedule look like for april 1st,calendar
2224,Do I have a 30th birthday party on my calendar?,calendar
2225,what does my calendar look like for may 6th,calendar
2226,what do i have planned on my calendar for next sunday,calendar
2227,search for a birthday party in my calendar,calendar
2228,what time is my haircut on wednesday,calendar
2229,What's on my agenda for March 5th?,calendar
2230,what do i have on my calendar for march 2nd,calendar
2231,What items do I have on my calendar for Easter?,calendar
2232,what do i have on my calendar for march 11th,calendar
2233,Do I have anything on my calendar next Sunday?,calendar
2234,what should i do on march 2nd which is on my calendar,calendar
2235,what happens on may 3rd,calendar
2236,"26th, what's on my calendar table?",calendar
2237,Do I have anything planned for May 3rd?,calendar
2238,Does my calendar include an event called Shana's baby shower?,calendar
2239,Does my calendar have anything for January 1st?,calendar
2240,tell me all about my calendar for may 1st,calendar
2241,what do i have planned for february 28th,calendar
2242,Do I have any appointments on Tuesday?,calendar
