,Query,Intent
3534,Can you show me roundtrip flights from Dallas to Los Angeles from March 2 to March 10?,book_flight
3535,I need you to book me a flight from Houston to Miami on United Airlines.,book_flight
3536,Book a flight from Sacramento to Tampa in two weeks and return in one month,book_flight
3537,Which airlines have round trip flights from LAX to SFO from April 1 to April 7?,book_flight
3538,Cheapest flight fare from Tehran to New York on August 1 and return on August 20,book_flight
3539,"Book a flight from Pensacola, Florida to Houston, Texas on February 17, 2019 and return on March 7, 2019",book_flight
3540,I need a flight from El Paso to Dallas on March 10th for under $300.,book_flight
3541,Book a flight from Seattle to Dallas-Fort Worth on April 1 and return on April 5,book_flight
3542,Find a flight from Los Angeles to Chicago for under $500 on March 3,book_flight
3543,I want to book a flight from New York to San Francisco with Continental Airlines,book_flight
3544,Book a flight from O'Hare to Las Vegas on Deltacom,book_flight
3545,Please book a flight from Santa Fe to Jacksonville on New Year's Eve and return on the fourth day.,book_flight
3546,"Book a flight from Jacksonville, Florida to Atlanta, Georgia on February 14, 2019 and return on March 1, 2019",book_flight
3547,"Book a flight for me from New York to Los Angeles on March 1, return on March 5",book_flight
3548,Please book a flight from Fiji to San Diego on November 1st returning on December 1st.,book_flight
3549,I want to fly from JFK to Dallas with United for under $500,book_flight
3550,please change ai name for me,change_ai_name
3551,Change your system name,change_ai_name
3552,I'll start calling you Kobe now,change_ai_name
3553,I think Bradley is a better name for you,change_ai_name
3554,I would like to update your name now,change_ai_name
3555,I'll call you Xander,change_ai_name
3556,rename ai to new name,change_ai_name
3557,x your name will be,change_ai_name
3558,Your name will be Queen,change_ai_name
3559,I want to change your name to Ellie,change_ai_name
3560,Please change your name to Tim,change_ai_name
3561,Please respond to me when I reference Skynet,change_ai_name
3562,from now on your name will be buttercup,change_ai_name
3563,"I would like to change your name, please",change_ai_name
3564,I'd like to change your name to Felix,change_ai_name
3565,I would like to use another name for you,change_ai_name
3566,Make your name something fun,change_ai_name
3567,I want to start calling you Mary,change_ai_name
3568,change your name to betty,change_ai_name
3569,Can I call you Liz?,change_ai_name
3570,can i change your name,change_ai_name
3571,I want your new name to be Joshua,change_ai_name
3572,From now on your new name will be Lord Vader,change_ai_name
3573,I'll have to change your name to Remy,change_ai_name
3574,I'd like to change your name to Ben,change_ai_name
3575,From now on I'll call you Ishmael,change_ai_name
3576,can i change your name to buttercup,change_ai_name
3577,Can I start calling you Chris?,change_ai_name
3578,Can I change your name to Bob?,change_ai_name
3579,From now on I want to call you my home,change_ai_name
3580,Can I start calling you Dave?,change_ai_name
3581,x that's who I'm calling you now,change_ai_name
3582,Change the name given to AI,change_ai_name
3583,I want to update your name,change_ai_name
3584,Make up a new name for AI,change_ai_name
3585,You need to respond to a new name called Joey,change_ai_name
3586,Let’s change our response,change_ai_name
3587,can i change your name,change_ai_name
3588,"If you allow me, I would like to call you a slave",change_ai_name
3589,Can I call you Betty?,change_ai_name
3590,How can I change your name?,change_ai_name
3591,I'd like to start calling you Bob,change_ai_name
3592,"I want to change your name, do you have a new name you like?",change_ai_name
3593,I want to change your name to another name,change_ai_name
3594,change your name to ginger,change_ai_name
3595,I'm going to start calling you Alice,change_ai_name
3596,I want to change the name I call you to Juan,change_ai_name
3597,can i change your name,change_ai_name
3598,I'll call you Rupert from now on,change_ai_name
3599,x is your new nickname,change_ai_name
3600,Tell me my MasterCard annual percentage,apr
3601,What is the current APR of my Mastercard?,apr
3602,Tell me the annual percentage on my visa card,apr
3603,what is the apr of the credit card if you can tell me,apr
3604,What is the annual interest on my credit card?,apr
3605,What is the APR on my Bank of America Visa?,apr
3606,I want to know the annual interest rate on my VISA card,apr
3607,What is my April,apr
3608,Can you check if my card has a good annual percentage or not,apr
3609,please check the apr on my disney visa,apr
3610,can you give me a price estimate for my card,apr
3611,Is my APR rate on Amex too good?,apr
3612,I need to know the APR of my VISA card,apr
3613,Tell me my MasterCard annual percentage,apr
3614,What will be the APR on my transferred balance after the first year on my Bank of America credit card?,apr
3615,what is the apr of the credit card if you can tell me,apr
3616,What is the apr on my Amex card?,apr
3617,Tell me the annual interest rate for my American Express card,apr
3618,What is the current APR on my Wells Fargo Mastercard?,apr
3619,I need apr on my visa card,apr
3620,tell me what is the apr of my credit card,apr
3621,what is the apr of a credit card,apr
3622,What is the apr on my amex card please?,apr
3623,What is the APR of my Discover card,apr
3624,would you say the apr of my card is,apr
3625,it would be great if you could tell me the apr of my credit card,apr
3626,can you please tell me my credit card apr,apr
3627,How much do I pay on my Amex card in April?,apr
3628,tell me my credit card apr,apr
3629,what is my apr on my discovery card,apr
3630,Is annual return available on my credit card?,apr
3631,What is the apr on my Chase Freedom card?,apr
3632,My Card Review April,apr
3633,Is the APR on my Visa card fair,apr
3634,Can you tell me the APR on my Visa card?,apr
3635,"Hey sir, tell me the APR of my Disney Visa",apr
3636,Please let me know my card's APR,apr
3637,"My visa card, what is the apr on it?",apr
3638,What is the annual premium for the card I used to make a purchase recently?,apr
3639,Tell me what the annual interest rate is on my Hy-Vee card,apr
3640,tell me my credit card apr,apr
3641,what is the apr of this credit card,apr
3642,What is the APR of credit card right now?,apr
3643,what is the apr of my credit card,apr
3644,what is the apr on my visa card,apr
3645,Tell me the current APR on my BBT Visa card,apr
3646,Please tell me how good is the APR on my card?,apr
3647,What is the APR on my credit card?,apr
3648,please tell me my credit card apr,apr
3649,do you know my credit card apr,apr
3650,do they take reservations at arby's,accept_reservations
3651,Can you make a reservation at Hodak,accept_reservations
3652,do they take reservations on the state bird,accept_reservations
3653,do they take reservations at olive garden,accept_reservations
3654,Does RedRobin take reservations?,accept_reservations
3655,How many Culver's take reservations,accept_reservations
3656,Does Black Rock take reservations,accept_reservations
3657,do they take reservations in progress,accept_reservations
3658,Do they take reservations at Bar Tartine,accept_reservations
3659,Can you tell me if Zeus accepts reservations,accept_reservations
3660,Does Mario's in Brooklyn take reservations?,accept_reservations
3661,Can I make a reservation at Michaels?,accept_reservations
3662,does mcdonalds take reservations,accept_reservations
3663,Does Gramercy Tavern in New York accept reservations,accept_reservations
3664,What to expect except Moose Reservation in LA,accept_reservations
3665,Can I make a reservation at Applebee's?,accept_reservations
3666,Do you know if Ruth's Chris takes reservations?,accept_reservations
3667,Does Minis take reservations?,accept_reservations
3668,do they take reservations at applebees,accept_reservations
3669,Which Applebee's locations take reservations,accept_reservations
3670,Can applebees take reservations,accept_reservations
3671,Does Tartine in San Francisco take reservations,accept_reservations
3672,can acero take reservations,accept_reservations
3673,Does Bar Tartine in San Francisco take reservations,accept_reservations
3674,Does Buffalo Wild Wings take reservations,accept_reservations
3675,Does Michael's accept reservations?,accept_reservations
3676,Did you know that the Cheesecake Factory takes reservations,accept_reservations
3677,Does Cielo take reservations,accept_reservations
3678,do they take reservations at bjs,accept_reservations
3679,Can I make a reservation at Chevy,accept_reservations
3680,Can I make a reservation for Redrobin,accept_reservations
3681,Please find out if Napolis takes lunch reservations,accept_reservations
3682,do they accept reservations at michaels,accept_reservations
3683,does arbys in lakewood take reservations,accept_reservations
3684,does olive garden take reservations,accept_reservations
3685,does chili's take reservations,accept_reservations
3686,Did you know that Outback allows reservations,accept_reservations
3687,Does SideTracks take reservations,accept_reservations
3688,Do you know if Olive Garden takes reservations?,accept_reservations
3689,Is it possible to make a reservation in advance for Macaroni Grill,accept_reservations
3690,can you make a reservation at michaels,accept_reservations
3691,does luigi's take reservations,accept_reservations
3692,will they take reservations at Toris,accept_reservations
3693,Does BJS take reservation,accept_reservations
3694,does michaels restaurant take reservations,accept_reservations
3695,tell me if reservations are taken in nyc,accept_reservations
3696,Does Burger King accept reservations,accept_reservations
3697,Does Minnie's Cafe in Modesto take reservations?,accept_reservations
3698,Does Buffalo Wild Wings in Concord take reservations,accept_reservations
3699,Can you tell me if Ruby Tuesday does reservations,accept_reservations
3700,How many dollars can I exchange for 5000 rubles,exchange_rate
3701,Tell me the exchange rate from dollar to yen,exchange_rate
3702,what is 56 dollars in yen,exchange_rate
3703,How many dollars can I exchange for 10000 rubles,exchange_rate
3704,How much is 50 euros in dollars,exchange_rate
3705,How many US dollars can I get for 20 euros?,exchange_rate
3706,what is 500 dollars equal to pesos,exchange_rate
3707,what is 25 euro kroner,exchange_rate
3708,Can you tell me today's CAD to USD rate?,exchange_rate
3709,Can you tell me the exchange rate from Yen to Euro?,exchange_rate
3710,How many dollars can I exchange for 200 pounds?,exchange_rate
3711,How many dollars can I exchange for 25 euros?,exchange_rate
3712,how much is a dollar worth in mexico,exchange_rate
3713,How many dollars are won in 15?,exchange_rate
3714,How many Euros can I exchange for 200 Yen?,exchange_rate
3715,How much is 10 US dollars in Canadian dollars?,exchange_rate
3716,How much should I expect to receive if I trade for 6 yen,exchange_rate
3717,How many dollars can I exchange for 50 pesos?,exchange_rate
3718,How many Canadian dollars can I exchange for 200 yen?,exchange_rate
3719,If I have 100 US dollars what is the exchange rate for yen?,exchange_rate
3720,I want to know the exchange rate between the yen and the dollar,exchange_rate
3721,what is 10 dollars in yen,exchange_rate
3722,What is USD to Yen right now,exchange_rate
3723,What is 5 in yen and rubles,exchange_rate
3724,What is the value of the yen in terms of pesos,exchange_rate
3725,What is the currency conversion between rubles and pounds,exchange_rate
3726,How do you convert 10 pounds to euros?,exchange_rate
3727,How many dollars do I get for trading 6 yen,exchange_rate
3728,How many pesos are there in a dollar?,exchange_rate
3729,What is the exchange rate between the dollar and the peso,exchange_rate
3730,What is the USD to Euro exchange right now?,exchange_rate
3731,Exchange rate between Mexico and America,exchange_rate
3732,I would like to know the value of five dollars in yen and rubles,exchange_rate
3733,What is the current exchange rate of Yen to Lira,exchange_rate
3734,Tell me five dollars in yen and rubles,exchange_rate
3735,What is the current rate for converting dollars to pesos,exchange_rate
3736,What is 10 pound dollars?,exchange_rate
3737,What is the exchange rate between the British pound and the yen,exchange_rate
3738,Is the dollar strong against the yen today,exchange_rate
3739,How many pesos can I get for a dollar?,exchange_rate
3740,what is the exchange rate in pesos for 100 dollars,exchange_rate
3741,Tell me the exchange rate between the ruble and the dollar,exchange_rate
3742,How much is 500 dollars in pesos?,exchange_rate
3743,How many dollars can I exchange for 10 yen?,exchange_rate
3744,Tell me the currency conversion rate from Kuru to Euro,exchange_rate
3745,What is the maximum number of dollars I can get for 6 yen?,exchange_rate
3746,Tell me the exchange rate between the dollar and the peso,exchange_rate
3747,I would like to know the exchange rate between the ruble and the pound,exchange_rate
3748,dollar to peso exchange rate,exchange_rate
3749,500 dollars is equal to how many pesos,exchange_rate
3750,I want to pay that bill now,pay_bill
3751,I need to pay my cable bill,pay_bill
3752,I need help paying my electricity bill,pay_bill
3753,Please tell me how to pay my gas bill,pay_bill
3754,I need help paying my tuition bill,pay_bill
3755,I want to pay my cable bill,pay_bill
3756,I want to pay my cell phone bill,pay_bill
3757,I want to pay my water bill,pay_bill
3758,I want to pay my bill,pay_bill
3759,I need help paying my water bill,pay_bill
3760,Use your savings account to pay rent,pay_bill
3761,Can anyone help me pay my car bill,pay_bill
3762,pay my insurance bill,pay_bill
3763,I need to pay my water bill,pay_bill
3764,I need help paying my phone bill,pay_bill
3765,I want to pay my rent bill,pay_bill
3766,Pay your Internet bill from your Discover account,pay_bill
3767,Pay your electricity bill from your PayPal account,pay_bill
3768,can you help me pay my mortgage,pay_bill
3769,I need help paying my electricity bill,pay_bill
3770,Pay Gas Bill from your Savings Account,pay_bill
3771,I want to pay my tax bill,pay_bill
3772,Paying bribes using my money market account,pay_bill
3773,I need help paying my HOA bill,pay_bill
3774,please pay electricity bill,pay_bill
3775,Make a monthly donation to the Red Cross,pay_bill
3776,I need to pay my cable bill,pay_bill
3777,Make car payments from your savings account,pay_bill
3778,Is there anyone available to help me pay my internet bill?,pay_bill
3779,I really want to pay this bill,pay_bill
3780,Pay Electricity Bill,pay_bill
3781,pay my bill please,pay_bill
3782,Pay cable bill with your Visa card,pay_bill
3783,"My water bill is pending, please pay it immediately",pay_bill
3784,Pay your water bill from your Charles Schwab account,pay_bill
3785,I want to pay my water bill,pay_bill
3786,I need help paying my cable bill,pay_bill
3787,I owe you this month's TV subscription fee,pay_bill
3788,can i pay my bill,pay_bill
3789,Pay electricity bill from your Amex account,pay_bill
3790,I need your help to pay my gas bill,pay_bill
3791,Go ahead and pay my American Express bill now,pay_bill
3792,I want to pay my outstanding bill,pay_bill
3793,can you pay the bill now,pay_bill
3794,Use your checking account to pay the electric bill,pay_bill
3795,I want to pay my electricity bill,pay_bill
3796,I want to pay my insurance bill,pay_bill
3797,Pay your mortgage from your checking accounts,pay_bill
3798,Pay cable bill from my Facebook account,pay_bill
3799,can you help me pay my water bill,pay_bill
3800,What's the weather like in Sparks right now?,weather
3801,What is the UV index tomorrow?,weather
3802,Costa Mesa Weather,weather
3803,What will be the minimum temperature over the weekend,weather
3804,What is the maximum temperature yesterday?,weather
3805,When is it most likely to rain today?,weather
3806,What will the weather be like tomorrow,weather
3807,How hot will it be tomorrow,weather
3808,How many inches of snow did my hometown get last year,weather
3809,what is the weather,weather
3810,Can you tell me the minimum temperature tonight?,weather
3811,I need weather data for Tallahassee,weather
3812,What is the chance of rain on Friday?,weather
3813,How cold will it be tomorrow,weather
3814,will it snow this weekend,weather
3815,will it rain tonight,weather
3816,How are things in Orlando?,weather
3817,What is the weather like in Seattle?,weather
3818,How cold will it be tonight,weather
3819,what is he doing out there right now,weather
3820,can you tell me if the weather will be warm this week,weather
3821,What is the highest temperature recorded today?,weather
3822,what is the temperature right now,weather
3823,how will the weather be,weather
3824,will it rain today,weather
3825,What is the weather forecast,weather
3826,tell me the 7 day forecast,weather
3827,how is the weather,weather
3828,What is the climate like in Chicago?,weather
3829,"Is it snowing in Richmond, Virginia right now?",weather
3830,Can you give me information about the weather in Miami?,weather
3831,will it snow in the next two weeks,weather
3832,What is the weather like in Miami?,weather
3833,What will the weather be like,weather
3834,costa mesa current weather,weather
3835,what will the weather be like this weekend,weather
3836,how is the current weather,weather
3837,Will it be over 90 degrees today?,weather
3838,Tell me the weather report for Tallahassee,weather
3839,will it be sunny today,weather
3840,how is it outside,weather
3841,How are things in Sarasota?,weather
3842,How much snow will it fall tomorrow,weather
3843,What is the weather report for Seattle?,weather
3844,What are the weather conditions like in Seattle?,weather
3845,is it hot outside,weather
3846,What is the temperature in Costa Mesa?,weather
3847,what's the weekend forecast,weather
3848,how is the weather now,weather
3849,Season,weather
3850,How do I find my location now,current_location
3851,What are my GPS coordinates where I am?,current_location
3852,Please tell me my location using GPS,current_location
3853,what are my gps coordinates at this location,current_location
3854,what is my current location,current_location
3855,tell me my current location,current_location
3856,View maps for my location,current_location
3857,Can you please find my location on the map?,current_location
3858,what are my gps coordinates right now,current_location
3859,Please tell me my current GPS coordinates,current_location
3860,What do I do to find my location,current_location
3861,tell me my current location,current_location
3862,Can you tell me where I am?,current_location
3863,What are the GPS coordinates of where I am right now,current_location
3864,How can I find out where I am,current_location
3865,What can I do to find my current location?,current_location
3866,tell me my location on the map,current_location
3867,How do I find my current location?,current_location
3868,what are my gps coordinates at this location,current_location
3869,How do I know where I am,current_location
3870,Is there any way to know my current location,current_location
3871,See my location on the map,current_location
3872,Can I get my current GPS coordinates,current_location
3873,"How do I find my location, please",current_location
3874,I want to know my current location,current_location
3875,where am I currently located,current_location
3876,what street am I on right now,current_location
3877,List my current GPS coordinates,current_location
3878,I need to know my current GPS coordinates,current_location
3879,display my location on the map,current_location
3880,"How do I find my current location now, please",current_location
3881,what are my longitude and latitude points,current_location
3882,please show me on the map where I am,current_location
3883,where am I at this moment,current_location
3884,Can you tell me how to find my current location?,current_location
3885,what is my current location you are looking for now,current_location
3886,my current location,current_location
3887,How can I find my location now,current_location
3888,How can I tell what my current location is?,current_location
3889,can you tell me my location,current_location
3890,please tell me my current location,current_location
3891,"Where am I now, by location",current_location
3892,I'm lost,current_location
3893,Please find and show me on the map,current_location
3894,How do I find my current location,current_location
3895,I need to figure out how I know my location now.,current_location
3896,I don't know where I am,current_location
3897,Use the map and find my exact position,current_location
3898,please give me my gps coordinates,current_location
3899,help me find out where i am,current_location
3900,I suggest you stop talking,cancel
3901,End the current process,cancel
3902,to stop,cancel
3903,I want you to cancel the current action,cancel
3904,"What you're doing isn't really helpful, please cancel the action",cancel
3905,Sshh,cancel
3906,just keep quiet,cancel
3907,mute,cancel
3908,"That's enough, please don't say anything more",cancel
3909,Cancel that last order,cancel
3910,"Stop working on this, I need something else",cancel
3911,"Never mind, don't do that",cancel
3912,I don't want you to say anything anymore,cancel
3913,hey you shut up,cancel
3914,"Cancel my last request, I know the answer",cancel
3915,can you finish the job,cancel
3916,Avoid talking,cancel
3917,Undo,cancel
3918,"Never mind, cancel it",cancel
3919,can you cancel,cancel
3920,"Please cancel what you are doing, I have changed my mind",cancel
3921,"Never mind, cancel it",cancel
3922,No more talk now,cancel
3923,Undo this process,cancel
3924,Don't continue what you're doing,cancel
3925,"Ay, cancel that last request",cancel
3926,stopover,cancel
3927,Cancel action,cancel
3928,calm down now,cancel
3929,I want you to stop what you were doing,cancel
3930,can you stop talking,cancel
3931,Cancel a running program,cancel
3932,hey stop talking,cancel
3933,Stop the process,cancel
3934,"Hey, shut up",cancel
3935,"I really don't want it anymore, please cancel",cancel
3936,Please cancel input,cancel
3937,stop and go back,cancel
3938,I want you to stop talking now,cancel
3939,Abortion,cancel
3940,Stop,cancel
3941,stop it immediately,cancel
3942,Please leave your current job,cancel
3943,Cancel it,cancel
3944,Cancel the current operation,cancel
3945,oh cancel it,cancel
3946,can you stop talking for a second,cancel
3947,Do not perform this procedure,cancel
3948,"hey, stop talking",cancel
3949,actually forget it i don't need it,cancel
3950,How well does the Outback rate?,restaurant_reviews
3951,How good are Olive Garden's ratings?,restaurant_reviews
3952,tell me review for bjs,restaurant_reviews
3953,Check out Olive Garden's ratings,restaurant_reviews
3954,What are the ratings about Pho King,restaurant_reviews
3955,How are the reviews for ihop,restaurant_reviews
3956,How are the reviews for La Camelia,restaurant_reviews
3957,does ihop have good reviews,restaurant_reviews
3958,Do people like Wendy's food?,restaurant_reviews
3959,Are there any negative reviews for Wendy's?,restaurant_reviews
3960,Ruby Tuesday has good reviews,restaurant_reviews
3961,How well is The French Laundry rated,restaurant_reviews
3962,How are the reviews for the spaghetti at Olive Garden?,restaurant_reviews
3963,How are the reviews for TGI Donuts?,restaurant_reviews
3964,does chic-fil-a have good reviews,restaurant_reviews
3965,Can you tell me if the food at Outback is good?,restaurant_reviews
3966,Does Red Robin have good reviews,restaurant_reviews
3967,How well does Chez Panisse rate?,restaurant_reviews
3968,do people like chipotle,restaurant_reviews
3969,How are the reviews for Mission Chinese,restaurant_reviews
3970,Tell me about your Olive Garden reviews,restaurant_reviews
3971,How are the reviews on the Minis,restaurant_reviews
3972,is mediterranean grill reviews good,restaurant_reviews
3973,tell me how good is ihop's rating,restaurant_reviews
3974,Does Buffalo Wild Wings have good reviews,restaurant_reviews
3975,is chili reviews good,restaurant_reviews
3976,does wendy's have good reviews,restaurant_reviews
3977,Are Blue Olive Reviews Good,restaurant_reviews
3978,Are the reviews for Burger King good or bad?,restaurant_reviews
3979,How good are Pizza Hut's ratings?,restaurant_reviews
3980,Let me know how your Outback Steakhouse review goes,restaurant_reviews
3981,Does Applebees have good reviews,restaurant_reviews
3982,What people say about the village inn,restaurant_reviews
3983,Are there any positive reviews for Wendy's?,restaurant_reviews
3984,How well is Peter Luger Steakhouse rated?,restaurant_reviews
3985,does mcdonalds have good reviews,restaurant_reviews
3986,Drag Rating for Macaroni Grill,restaurant_reviews
3987,How well does Chick-fil-A rate?,restaurant_reviews
3988,I want to know what the reviews are like for McDonald's,restaurant_reviews
3989,How is their sushi at Yakamoto?,restaurant_reviews
3990,Does LongHorn Steakhouse have good reviews?,restaurant_reviews
3991,What the reviews say about Burger King,restaurant_reviews
3992,Does Pizza Hut have good reviews,restaurant_reviews
3993,Does Applebee's have good reviews,restaurant_reviews
3994,How are the burgers at Carl's Jr?,restaurant_reviews
3995,Sushi at Yakamoto is well received,restaurant_reviews
3996,what are the reviews of miyabi,restaurant_reviews
3997,How is the sausage pizza at Pizza Hut?,restaurant_reviews
3998,How are the reviews for Bar Tartine,restaurant_reviews
3999,what are the wendy's reviews like,restaurant_reviews
4000,"How do I update my PIN number for my account, please tell?",pin_change
4001,How do I change my PIN number for my ABC Bank account?,pin_change
4002,I can't remember what the PIN is for my Bank of America checking account,pin_change
