,Query,Intent
5238,Does Japan have any travel alerts I should be aware of?,travel_alert
5239,Is it safe to travel to Russia,travel_alert
5240,I would like to see if there is a travel alert for the country,travel_alert
5241,Does the country have a travel alert?,travel_alert
5242,Are there any alerts for travel to Beirut?,travel_alert
5243,Is it safe to travel to Brazil?,travel_alert
5244,Does Kenya have any travel alerts right now?,travel_alert
5245,are there any travel alerts for north korea,travel_alert
5246,What are the China travel alerts?,travel_alert
5247,Does China have any travel alerts I should be aware of?,travel_alert
5248,Is New Caledonia safer than other countries?,travel_alert
5249,Does Germany have any travel alerts I should be aware of?,travel_alert
5250,my card melted in the dryer and i have to report it please,damaged_card
5251,"my card is cut in half, how can i report it",damaged_card
5252,how to report a melted credit card,damaged_card
5253,my card broke in two and i have to report it,damaged_card
5254,How do I report that my card has been scratched?,damaged_card
5255,my card melted and i have to report it,damaged_card
5256,I need a report form for my damaged and demagnetized card,damaged_card
5257,my card is too scratched and i have to report it,damaged_card
5258,I need to replace my credit card because I ran it over with the lawn mower,damaged_card
5259,My card chip is damaged and I need a new one,damaged_card
5260,My card was damaged by my cat; can I report it?,damaged_card
5261,"my card is cut in two, can i report it",damaged_card
5262,my card fell in the toilet and now the chip doesn't work anymore,damaged_card
5263,My card has been deleted and I have to report it,damaged_card
5264,"the card is torn, let's report it",damaged_card
5265,the corner of my credit card is chipped,damaged_card
5266,what should i do with an unusable and damaged card,damaged_card
5267,I ran over my credit card with the lawn mower and need to replace it,damaged_card
5268,I can't use my card because it's broken,damaged_card
5269,my card is damaged and no longer works,damaged_card
5270,my dog ate my credit card and ruined it,damaged_card
5271,my card is damaged so i can't use it,damaged_card
5272,I can't use my damaged card,damaged_card
5273,"my card is partially damaged, how can i report it",damaged_card
5274,I have to report that my dog chewed my card,damaged_card
5275,report to the company that I damaged my card,damaged_card
5276,report that the card has been damaged,damaged_card
5277,my card fell out of my wallet and i swiped over it so it doesn't work,damaged_card
5278,"ATM ate my card, how do I report it",damaged_card
5279,I need a new card because my dog chewed it and now it doesn't work,damaged_card
5280,I have to report a folded card,damaged_card
5281,"My card is destroyed, let's report it",damaged_card
5282,my card melted and i have to report it please,damaged_card
5283,My card has been damaged and I need to report it,damaged_card
5284,my card doesn't work anymore,damaged_card
5285,my card was broken in two,damaged_card
5286,my broken card doesn't work,damaged_card
5287,my card is broken can you tell my bank to send a replacement card,damaged_card
5288,report that the card has been destroyed,damaged_card
5289,the plastic numbers on my card are falling off,damaged_card
5290,I want to report a broken card,damaged_card
5291,call the card company and ask them to replace my card,damaged_card
5292,My card is unusable because it is damaged,damaged_card
5293,I demagnetized my card and I want to report it,damaged_card
5294,I don't know who to tell that I ran over my credit card with the lawn mower.,damaged_card
5295,I damaged the card; can you replace the card,damaged_card
5296,"I accidentally folded my card, what should I do?",damaged_card
5297,my credit card broke in half while i was handling it,damaged_card
5298,I accidentally put my credit card in the shredder,damaged_card
5299,I dropped my card in my gas and the impression faded,damaged_card
5300,turn this coin over,flip_coin
5301,"please toss this coin, i choose tails",flip_coin
5302,"flip a coin, you win with heads",flip_coin
5303,Would you toss a coin?,flip_coin
5304,Please tell me if a coin lands on tails,flip_coin
5305,I have to make a fair draw,flip_coin
5306,I want to toss a coin and I get tails,flip_coin
5307,Heads or tails,flip_coin
5308,I want you to toss a fair coin,flip_coin
5309,spin a coin,flip_coin
5310,toss a coin and tell me if it lands heads or tails please,flip_coin
5311,would you like to flip a coin so I can make a choice?,flip_coin
5312,"ai, please flip a coin",flip_coin
5313,I needed you to flip a coin,flip_coin
5314,Heads or tails I choose tails,flip_coin
5315,"I toss a coin, I say tails",flip_coin
5316,to draw lots,flip_coin
5317,"go ahead and flip that coin, I choose tails here",flip_coin
5318,I want to flip a coin,flip_coin
5319,"ai, heads or tails",flip_coin
5320,"go ahead, flip a coin, I call tails",flip_coin
5321,toss the coin,flip_coin
5322,flip a coin for me,flip_coin
5323,"Flip a coin for me, and you call heads",flip_coin
5324,please return it,flip_coin
5325,return a quarter,flip_coin
5326,"I choose tails, now toss this coin",flip_coin
5327,flip a coin and tell me what it lands on,flip_coin
5328,Can you do a draw?,flip_coin
5329,"Please flip a coin for me, tails I win",flip_coin
5330,I toss a coin and I get tails,flip_coin
5331,let's decide with a draw,flip_coin
5332,"Please flip a coin, I hope it's tails",flip_coin
5333,are you going to take a coin and toss it?,flip_coin
5334,flip a two-sided coin and tell me what it lands on,flip_coin
5335,Can you flip a coin once?,flip_coin
5336,please toss this coin,flip_coin
5337,toss a coin heads or tails,flip_coin
5338,Heads or tails please,flip_coin
5339,I will determine it with a draw,flip_coin
5340,"ai, heads or tails",flip_coin
5341,Start the draw now,flip_coin
5342,Pick a head or tail and tell me what you found.,flip_coin
5343,toss this coin once; it must be tails,flip_coin
5344,flip a coin if you want,flip_coin
5345,I need a draw,flip_coin
5346,I need you to flip a coin so I can decide,flip_coin
5347,Please flip a coin and tell me which side it lands on.,flip_coin
5348,I want you to help me make a decision by flipping a coin,flip_coin
5349,I'm calling for a draw that you must do right away,flip_coin
5350,where are good thai restaurants in las vegas,restaurant_suggestion
5351,"In Boston, what are the best pizzerias?",restaurant_suggestion
5352,which mexican restaurant within 5 miles has the best reviews,restaurant_suggestion
5353,"I'm hungry, where should I go?",restaurant_suggestion
5354,Does Boise have any good Indian restaurants?,restaurant_suggestion
5355,Can you recommend me some restaurants?,restaurant_suggestion
5356,recommendations for good thai restaurants in las vegas,restaurant_suggestion
5357,Is there a good place to eat Mexican food in Hawaii,restaurant_suggestion
5358,can you recommend me an indian restaurant,restaurant_suggestion
5359,can you list 4 star restaurants,restaurant_suggestion
5360,what is the best place to eat thai food in new york,restaurant_suggestion
5361,"I'm craving Italian food, are there any good places nearby?",restaurant_suggestion
5362,What are some good sushi restaurants in Reno?,restaurant_suggestion
5363,find an indian restaurant,restaurant_suggestion
5364,Can you recommend a good place in Chicago to get pizza?,restaurant_suggestion
5365,Where should I go for dinner?,restaurant_suggestion
5366,Is there a good place to eat Vietnamese food on the east side of the island?,restaurant_suggestion
5367,Is there a barbecue restaurant nearby?,restaurant_suggestion
5368,I'm hungry so give me places to eat!,restaurant_suggestion
5369,Is there a good place in Hawaii to eat pasta?,restaurant_suggestion
5370,can you tell me the best place to eat cajun shrimp in tampa,restaurant_suggestion
5371,can you find a good steakhouse for tonight,restaurant_suggestion
5372,Can you find me a good restaurant to try eating at?,restaurant_suggestion
5373,what good restaurants here are italian,restaurant_suggestion
5374,Are there any sushi restaurants in Reno that have good reviews?,restaurant_suggestion
5375,Can you find me any good places in Kentucky that serve sushi?,restaurant_suggestion
5376,I need to know what restaurants are near me,restaurant_suggestion
5377,can you find a keto friendly restaurant,restaurant_suggestion
5378,give me some good restaurants,restaurant_suggestion
5379,what is a highly rated place for steak in omaha,restaurant_suggestion
5380,what are the good places to eat,restaurant_suggestion
5381,new restaurants near the shopping center,restaurant_suggestion
5382,tell me what are good restaurants for thai food in las vegas,restaurant_suggestion
5383,could you find me some good places in kentucky that serve sushi,restaurant_suggestion
5384,"I want to go out to eat but I don't know where to go, do you know any places?",restaurant_suggestion
5385,Do you know any good restaurants?,restaurant_suggestion
5386,I'm hungry and need a restaurant suggestion,restaurant_suggestion
5387,could you please tell me some good places in kentucky that serve sushi,restaurant_suggestion
5388,can you suggest any quality chinese restaurants in oklahoma city,restaurant_suggestion
5389,ideas for a good place to eat at a restaurant,restaurant_suggestion
5390,Please list nearby restaurants with 4 star or higher reviews,restaurant_suggestion
5391,what is a good restaurant nearby,restaurant_suggestion
5392,where is a good place to eat something,restaurant_suggestion
5393,can you list different restaurants,restaurant_suggestion
5394,"I'm not going to cook today, can you suggest a restaurant?",restaurant_suggestion
5395,what are some good places for a burrito in albuquerque,restaurant_suggestion
5396,is there a good fish restaurant in salem,restaurant_suggestion
5397,help me choose a good restaurant to dine at,restaurant_suggestion
5398,Do you know any good Mexican restaurants in Seattle?,restaurant_suggestion
5399,"it's a date and we don't know where to go, help me",restaurant_suggestion
5400,what is the smallest payment i can make on my xfinity bill,min_payment
5401,what is the minimum amount i have to pay for my cell phone bill,min_payment
5402,I would like to know the minimum payment for my credit card,min_payment
5403,what is the minimum amount of money required for bill payment,min_payment
5404,what is the minimum payment for my electricity bill,min_payment
5405,please tell me the minimum i can pay on my electricity bill,min_payment
5406,I want to know the minimum payment of the invoice,min_payment
5407,what is the minimum payment for the invoice,min_payment
5408,minimum to pay on the electricity bill,min_payment
5409,what is the minimum amount i can pay on the water bill,min_payment
5410,show my minimum payment for youtube,min_payment
5411,what is the minimum payment for my credit card bill,min_payment
5412,I need to know what the minimum payment is on my electricity bill,min_payment
5413,what is the lowest amount i can pay for my cable bill,min_payment
5414,show me the minimum payment for my boat bill,min_payment
5415,what is the minimum payment for my bill,min_payment
5416,what is the minimum payment i can make on my electricity bill,min_payment
5417,tell me the minimum payment of my bill,min_payment
5418,I would like to know the minimum payment for my water bill,min_payment
5419,pay the minimum payment for the invoice m and t,min_payment
5420,please give me the minimum total payment amount for my sprint phone bill,min_payment
5421,what is the minimum amount i can pay for my chase card bill,min_payment
5422,please inform me of the minimum invoice payment,min_payment
5423,can you tell me the minimum amount due on my visa this month,min_payment
5424,what is the minimum payment amount i can make on my electricity bill,min_payment
5425,what is the minimum payment required on my visa card,min_payment
5426,what is the minimum amount i have to pay on the electricity bill,min_payment
5427,what is the smallest amount i can pay on water bill,min_payment
5428,what is the minimum i can pay for medical expenses for february,min_payment
5429,what is the minimum payment amount on my chase card,min_payment
5430,what is the minimum payment for my internet bill,min_payment
5431,How much can I pay at least for my electricity bill?,min_payment
5432,find the minimum due on my peco energy bill for february,min_payment
5433,what is the smallest amount i can pay on my t-mobile bill,min_payment
5434,I would like to know the minimum payment of the invoice,min_payment
5435,what is the lowest amount i can pay for my electricity bill,min_payment
5436,How much can I pay for my water bill?,min_payment
5437,I need to know the minimum payment for my water bill,min_payment
5438,please find out the minimum I have to pay on my credit card,min_payment
5439,what is the minimum bill payment?,min_payment
5440,I want you to tell me the minimum I can pay on my rent bill,min_payment
5441,let me know the minimum i can pay on my cable bill,min_payment
5442,tell me the minimum i can pay on my cable bill,min_payment
5443,tell me the lowest amount i can pay for my cable bill,min_payment
5444,what is the minimum payment required for my cell phone bill,min_payment
5445,what is the minimum payment for our credit card bill,min_payment
5446,I want to know the minimum payment for my bill,min_payment
5447,what is the minimum i can pay for my electricity bill,min_payment
5448,what is the minimum amount i can pay for electricity bill,min_payment
5449,what is the minimum i can pay for my electricity bill,min_payment
5450,How much savings do I have?,balance
5451,what is my current balance,balance
5452,what is the status of my bank account,balance
5453,what is my current bank savings,balance
5454,What is my money market account balance?,balance
5455,is there enough money in my discover account for a vacation,balance
5456,What is my balance on my checking account?,balance
5457,What's left in my bank accounts?,balance
5458,what is my savings balance at chase,balance
5459,how much money is in my bank accounts,balance
5460,is there enough money in my discover account for a new pair of jeans,balance
5461,what is the total of my bank accounts,balance
5462,How much do I have in my checking account?,balance
5463,how much mastercard is left,balance
5464,what is my bank balance,balance
5465,check my visa account and see if I have enough money for dinner tonight,balance
5466,what is my checking account balance at chase,balance
5467,how much is available in my savings account,balance
5468,what is my bank balance,balance
5469,could you tell me what my checking account balance is,balance
5470,what is my checking account balance,balance
5471,can you tell me the current balance of my bank accounts,balance
5472,I want to know my US bank account balance,balance
5473,what is the current balance of my td bank savings account,balance
5474,What is the balance of my bank accounts?,balance
5475,how much money do i have in my account,balance
5476,I want to know the balance of my American bank account,balance
5477,what is my bank balance for all accounts,balance
5478,I want to know my bank balance,balance
5479,how much savings are there,balance
5480,tell me what i have in my money market account,balance
5481,Chase bank savings account balance please,balance
5482,what's in my bank accounts,balance
5483,Can you tell me how much money I have?,balance
5484,How much money do I have in total in the bank?,balance
5485,Do I have any money left?,balance
5486,Can funds from my Wells Fargo account cover my lift tickets?,balance
5487,What is my current balance on my home equity line of credit?,balance
5488,what is the total of my bank accounts,balance
5489,what kind of money is available in my bank accounts,balance
5490,What is the available balance in savings?,balance
5491,I need to know my bank balance,balance
5492,Do I have enough money in my Chase account for a plane ticket?,balance
5493,how much money is left in my bank accounts,balance
5494,check my current balance at chase bank,balance
5495,what is my balance,balance
5496,what is my savings account balance,balance
5497,what is my bank account balance,balance
5498,I want my current balance at Chase,balance
5499,please tell me my bank balance,balance
5500,how much is 10 ounces in grams,measurement_conversion
5501,how many centimeters are in 5 yards,measurement_conversion
5502,how many kilos are in 20 pounds,measurement_conversion
5503,convert 2 inches to meters,measurement_conversion
5504,what is 5 feet in inches,measurement_conversion
5505,how many centimeters are in an inch,measurement_conversion
5506,convert inches to centimeters,measurement_conversion
5507,how to convert ounces to kilograms,measurement_conversion
5508,How many tablespoons are in three cups?,measurement_conversion
5509,how many centimeters are in an inch,measurement_conversion
5510,how do i change inches to meters,measurement_conversion
5511,convert cm to inch,measurement_conversion
5512,How many tablespoons and teaspoons are in a cup?,measurement_conversion
5513,how to convert pounds to kilos,measurement_conversion
5514,I need to know how to convert liters to pints,measurement_conversion
5515,how many liters are in a gallon,measurement_conversion
5516,how many liters are in 500 gallons,measurement_conversion
5517,what is 12 feet in meters,measurement_conversion
5518,how much is 10 ounces in grams please,measurement_conversion
5519,is there an easy way to convert feet to inches,measurement_conversion
5520,what is 8 ounces in cups,measurement_conversion
5521,help me convert feet to miles,measurement_conversion
5522,how many inches and centimeters would i need if i had 10 feet of something,measurement_conversion
5523,what is 15 ounces in grams,measurement_conversion
5524,How many teaspoons are in a half cup?,measurement_conversion
5525,how to convert pounds to kilograms,measurement_conversion
5526,how many kilos are in 10 pounds,measurement_conversion
5527,what would be the conversion between tablespoons and teaspoons,measurement_conversion
5528,how many centimeters are in 4 inches,measurement_conversion
5529,what is 22 meters in inches,measurement_conversion
5530,How many crows are there in 10 murders?,measurement_conversion
5531,how to convert ounces to pounds,measurement_conversion
5532,how to convert ounces to grams,measurement_conversion
5533,how many teaspoons in a cup,measurement_conversion
5534,how many inches are in 5 feet,measurement_conversion
5535,how do i convert inches to yards,measurement_conversion
5536,tell me the conversion between tablespoons and cups,measurement_conversion
5537,how many feet are in 50 meters,measurement_conversion
5538,how many meters are in 10 millimeters,measurement_conversion
5539,tell me what ten pounds is in kilos,measurement_conversion
5540,convert inches to cm,measurement_conversion
5541,what is the conversion from inches to centimeters,measurement_conversion
5542,how much is 15 ounces in grams please,measurement_conversion
5543,how to convert miles to kilometers,measurement_conversion
5544,how to convert four inches to centimeters,measurement_conversion
5545,how many millimeters are in 50 kilometers,measurement_conversion
5546,how to convert inches and centimeters,measurement_conversion
5547,how to convert millimeters to decimeters,measurement_conversion
5548,how do i convert pounds to kilograms,measurement_conversion
5549,how many miles are five kilometers,measurement_conversion
5550,how and where are my W2 forms delivered,w2
5551,where can i get a w2 form,w2
5552,what is the location of my w2 that is needed for taxes,w2
5553,can you access my w-2,w2
5554,how do i get a personal w2 form,w2
5555,I would like to get the forms to fill out for my W2,w2
5556,Can you tell me what form employers are supposed to send you for taxes and where I can get it,w2
5557,who has the tax form that shows my salary,w2
5558,can you help me find my w-2,w2
5559,where can i get a w2 form,w2
5560,help me know where to go to get my W2 for tax purposes,w2
5561,where can i get a w2 form,w2
5562,how do i get a w2,w2
5563,Does my W2 arrive in the mail?,w2
5564,how do i get my year end summary for taxes,w2
5565,I'm having trouble locating my W-2,w2
5566,Where can I get the employment form I need to do my taxes?,w2
5567,what form do i need to declare my income,w2
5568,I need my W2 for tax purposes; please tell me where to get it,w2
5569,help me get a W2 to do my taxes,w2
5570,Do you know where my W-2 is?,w2
5571,can you tell me where to get a w2,w2
5572,where is my w2,w2
5573,where can i find my w-2,w2
5574,where can i get a w2 form,w2
5575,who has the tax form that contains my salary information,w2
5576,Can you locate my W-2?,w2
5577,I need to find my W2 so I can do my taxes,w2
5578,where do i go to get my w2 for tax purposes,w2
5579,Where can I get the form I need for taxes?,w2
5580,who can send me a W2 so i can fill out my taxes,w2
5581,Where can I get the form I need to do my taxes?,w2
5582,where can i find a form for my w2,w2
5583,locate my w-2 form,w2
5584,how do i get my w2 to do my taxes,w2
5585,Did I receive my W-2 by email?,w2
5586,how do i get a w2 form and from where,w2
5587,where would i find my w2 so i can do my taxes,w2
5588,Where can I find the form containing my tax information?,w2
5589,where can i get my w2 form,w2
5590,I would like to know how to find my w-2,w2
5591,I have to do my taxes and get a W2,w2
5592,where can i get the employment document i need to do my taxes please,w2
5593,where is w-2 form located,w2
5594,where can i get a w2,w2
5595,Where can I get the tax form I need to file with the IRS?,w2
5596,where do i go to get my w-2,w2
5597,I need help getting a W-2,w2
5598,where can i get a w2 form,w2
5599,what is this tax form that shows my salary and where can i get it,w2
5600,I would like an Uber please,uber
5601,can i get an uber for five people to go to the national gallery of art,uber
5602,we need an Uber pool for 2 passengers going to Greenboro airport,uber
5603,I need an Uber to go to the doctor,uber
5604,can i take an uber to union station for 3 passengers,uber
5605,"please book me an Uber and specify destination Penn Station, New York",uber
5606,I have to take an Uber somewhere,uber
5607,Can you give me an Uber to the science museum?,uber
5608,I need an Uber for 7 people to go to the Safire restaurant,uber
5609,I would like to take an Uber to go to the cinema,uber
5610,ai I have 4 people who have to come pick me up Uber,uber
5611,take an Uber to my brother's in Mineola,uber
5612,Do I have to go to Charlie's with eight adults? Can you take Uber?,uber
5613,I need an uber for 2 to Orlando,uber
5614,Can you send me an Uber to a restaurant in downtown Phoenix?,uber
5615,I want to book an Uber to go to the airport,uber
5616,call an uber to go to mark's house,uber
5617,I would like to ask for an Uber please,uber
5618,can i take an uber for 4 to go to the mall,uber
5619,I need to take an Uber for three people to go to the zoo,uber
5620,I need a reserved Uber to take me to the restaurant,uber
5621,take an Uber to the airport,uber
5622,Are there any Ubers available that can accommodate 5 people? We are going to Wendy's,uber
5623,I need an Uber that can seat ten people to go to Chipotle,uber
5624,Take me an Uber for 4 to Miam,uber
5625,call an uber to go to mcdonald's,uber
5626,plan an uber for 3 to go to the airport,uber
5627,I want to take an Uber for someone to go to the library,uber
5628,I need an Uber for 3 passengers to go to Madison Square Garden,uber
5629,schedule an Uber to the mall,uber
5630,I want to book an Uber for 3 people to Union Station,uber
5631,find an uber xl to take me to the kroger near me,uber
5632,"I would like an Uber to go to Atlantic City, New Jersey",uber
5633,can i get a car to the baseball field for 12,uber
5634,call an uber that fits 5 people who are on their way to wendy's,uber
5635,I'm stuck and need Uber,uber
5636,schedule me an Uber to the mall,uber
5637,I have to take an Uber to Cal Expo,uber
5638,please order an Uber for me to go to the zoo,uber
5639,I need an Uber to get to class tonight on the main campus,uber
5640,please book an Uber to Chima,uber
5641,help me get an Uber to Ann Arbor,uber
5642,"Uber, I have 3 people going to Union Station",uber
5643,arrange me an appointment with an Uber,uber
5644,I would like an Uber to go to the station please,uber
5645,Can you please book my Uber to go to Devon seafood restaurant,uber
5646,can you call an Uber for 2 to go to Proof on Main,uber
5647,I need an Uber to the hospital,uber
5648,I need an Uber to Times Square ASAP,uber
5649,I want an Uber,uber
5650,Can you add cherries to my shopping list?,shopping_list_update
5651,add eggs to my shopping list and remove cheese,shopping_list_update
5652,write apples on my shopping list,shopping_list_update
5653,I want you to add milk to my shopping list unless it's already there,shopping_list_update
5654,my shopping list should contain carrots,shopping_list_update
5655,maybe we can put blank cds on my shopping list,shopping_list_update
5656,"is bacon on my shopping list, add it if it's not",shopping_list_update
5657,add flour to my shopping list if it's not already there,shopping_list_update
5658,Please add milk to my shopping list if it is not already on it.,shopping_list_update
5659,put spaghetti on my shopping list because I'm out of it please,shopping_list_update
5660,add Sprite to my shopping list,shopping_list_update
5661,I need oranges on my shopping list,shopping_list_update
5662,remove carrots from my shopping list,shopping_list_update
5663,please make sure oranges are on my shopping list,shopping_list_update
5664,do me a favor and put some markers on my shopping list,shopping_list_update
5665,"is milk on the shopping list, if not please add it",shopping_list_update
5666,remove ice cream from my shopping list,shopping_list_update
